{
  "schema_version": 1,
  "kind": "full",
  "executed_at": "2026-09-14T11:10:58Z",
  "status": "complete",
  "verdict": "RED",
  "comparability_key": "499628cf34a35ce88ace52a50d0e65b6a52bcf73f0af4c0ec49b50293700db46",
  "contract_digest": "59b82ee3e6d7ccf2cfbe75cb11aa40e6ec93b92a754a992adee4a1a69166a259",
  "inputs": {
    "skill_digest": "89f5bdf20356c5515974ec1a6112fc4f9dfbf31cf1d60b667084f91dfbe6ec60",
    "skill_ref": "installed",
    "finder_argv_digest": "40099c93f78800efefbc46f57772ae2cbadc86b378bdd22f474945abfd7b450c",
    "orchestrator_digest": "fee8d511d838ad137aea62f0e6be7b5115383c59d4447ba985efb3e3c3fe48b1",
    "claude_cli": "2.1.270 (Claude Code)",
    "codex_cli": "codex-cli 0.154.0",
    "host": "Mac"
  },
  "conditions": {
    "pipeline": {
      "model": "claude-opus-5",
      "effort": "high",
      "finder": "gpt-5.6-sol@high",
      "draws": 1,
      "recall": {
        "matched": 19,
        "opportunities": 51,
        "rate": 0.373
      },
      "p1": {
        "matched": 7,
        "opportunities": 16,
        "rate": 0.438
      },
      "novel_real": 17,
      "wrong_claims": 2,
      "usd": 10.76,
      "seconds": 4428,
      "per_defect": {
        "3827636772": [
          1
        ],
        "3827647420": [
          0
        ],
        "3827655676": [
          1
        ],
        "3827655684": [
          0
        ],
        "3827663924": [
          0
        ],
        "3828303385": [
          0
        ],
        "3828304403": [
          0
        ],
        "3828313971": [
          0
        ],
        "3828313974": [
          0
        ],
        "3828328194": [
          0
        ],
        "3829654081": [
          1
        ],
        "3829659544": [
          1
        ],
        "3829659546": [
          1
        ],
        "3829659550": [
          0
        ],
        "3829986398": [
          0
        ],
        "3829986403": [
          0
        ],
        "3830003055": [
          0
        ],
        "3830042123": [
          1
        ],
        "3830042128": [
          0
        ],
        "3830259678": [
          1
        ],
        "3830366234": [
          1
        ],
        "3830366243": [
          1
        ],
        "3830366247": [
          0
        ],
        "3830366547": [
          1
        ],
        "3830366556": [
          0
        ],
        "3830371307": [
          0
        ],
        "3830371315": [
          0
        ],
        "3830371325": [
          1
        ],
        "3830371329": [
          0
        ],
        "3830394205": [
          0
        ],
        "3830416461": [
          1
        ],
        "3830423746": [
          0
        ],
        "3830513980": [
          0
        ],
        "3830695396": [
          0
        ],
        "3845594538": [
          0
        ],
        "3845596185": [
          1
        ],
        "3845603922": [
          0
        ],
        "3845603940": [
          0
        ],
        "3845607361": [
          1
        ],
        "3845618202": [
          0
        ],
        "3846756487": [
          1
        ],
        "3846756810": [
          0
        ],
        "3846756918": [
          0
        ],
        "3846756922": [
          1
        ],
        "3846757143": [
          0
        ],
        "3846757191": [
          1
        ],
        "3882085361": [
          1
        ],
        "3882086206": [
          0
        ],
        "3882090788": [
          0
        ],
        "3882119274": [
          1
        ],
        "3882119284": [
          0
        ]
      }
    },
    "replay": {
      "model": "claude-opus-5",
      "effort": "high",
      "finder": "gpt-5.6-sol@high",
      "draws": 2,
      "recall": {
        "matched": 36,
        "opportunities": 78,
        "rate": 0.462
      },
      "p1": {
        "matched": 10,
        "opportunities": 20,
        "rate": 0.5
      },
      "novel_real": 43,
      "wrong_claims": 4,
      "usd": 16.13,
      "seconds": 2743,
      "per_defect": {
        "3829654081": [
          1,
          0
        ],
        "3829659544": [
          1,
          0
        ],
        "3829659546": [
          1,
          0
        ],
        "3829659550": [
          0,
          0
        ],
        "3829986398": [
          0,
          0
        ],
        "3829986403": [
          0,
          0
        ],
        "3830003055": [
          0,
          1
        ],
        "3830042123": [
          1,
          1
        ],
        "3830042128": [
          0,
          0
        ],
        "3830259678": [
          1,
          1
        ],
        "3830366234": [
          0,
          1
        ],
        "3830366243": [
          0,
          1
        ],
        "3830366247": [
          1,
          0
        ],
        "3830366547": [
          1,
          1
        ],
        "3830366556": [
          1,
          0
        ],
        "3830371307": [
          1,
          0
        ],
        "3830371315": [
          1,
          1
        ],
        "3830371325": [
          1,
          1
        ],
        "3830371329": [
          1,
          0
        ],
        "3830394205": [
          0,
          0
        ],
        "3830416461": [
          1,
          1
        ],
        "3830695396": [
          0,
          0
        ],
        "3845594538": [
          0,
          0
        ],
        "3845596185": [
          1,
          1
        ],
        "3845603922": [
          0,
          0
        ],
        "3845603940": [
          0,
          0
        ],
        "3845607361": [
          1,
          1
        ],
        "3845618202": [
          1,
          0
        ],
        "3846756487": [
          1,
          1
        ],
        "3846756810": [
          1,
          1
        ],
        "3846756918": [
          0,
          1
        ],
        "3846756922": [
          0,
          1
        ],
        "3846757143": [
          0,
          0
        ],
        "3846757191": [
          1,
          1
        ],
        "3882085361": [
          0,
          0
        ],
        "3882086206": [
          0,
          0
        ],
        "3882090788": [
          0,
          0
        ],
        "3882119274": [
          0,
          0
        ],
        "3882119284": [
          1,
          0
        ]
      }
    },
    "control": {
      "model": "claude-opus-5",
      "effort": "high",
      "draws": 1,
      "recall": {
        "matched": 12,
        "opportunities": 39,
        "rate": 0.308
      },
      "p1": {
        "matched": 4,
        "opportunities": 10,
        "rate": 0.4
      },
      "novel_real": 17,
      "wrong_claims": 3,
      "usd": 5.89,
      "seconds": 865,
      "per_defect": {
        "3829654081": [
          0
        ],
        "3829659544": [
          0
        ],
        "3829659546": [
          0
        ],
        "3829659550": [
          0
        ],
        "3829986398": [
          0
        ],
        "3829986403": [
          0
        ],
        "3830003055": [
          0
        ],
        "3830042123": [
          1
        ],
        "3830042128": [
          0
        ],
        "3830259678": [
          1
        ],
        "3830366234": [
          0
        ],
        "3830366243": [
          0
        ],
        "3830366247": [
          1
        ],
        "3830366547": [
          1
        ],
        "3830366556": [
          1
        ],
        "3830371307": [
          0
        ],
        "3830371315": [
          0
        ],
        "3830371325": [
          1
        ],
        "3830371329": [
          0
        ],
        "3830394205": [
          0
        ],
        "3830416461": [
          0
        ],
        "3830695396": [
          0
        ],
        "3845594538": [
          1
        ],
        "3845596185": [
          1
        ],
        "3845603922": [
          0
        ],
        "3845603940": [
          0
        ],
        "3845607361": [
          0
        ],
        "3845618202": [
          1
        ],
        "3846756487": [
          0
        ],
        "3846756810": [
          1
        ],
        "3846756918": [
          0
        ],
        "3846756922": [
          0
        ],
        "3846757143": [
          0
        ],
        "3846757191": [
          1
        ],
        "3882085361": [
          1
        ],
        "3882086206": [
          0
        ],
        "3882090788": [
          0
        ],
        "3882119274": [
          0
        ],
        "3882119284": [
          0
        ]
      }
    }
  },
  "judge_calibration": {
    "agreement": 39,
    "total": 40
  },
  "scoring_usd": 11.91,
  "vs_baseline": null,
  "detail_dir": "docs/evals/review-skill-runs/2026-09-14-499628cf-full-89f5bdf2",
  "notes": ""
}
